{
  "$schema": "https://json-schema.org/draft/2020-12/schema",
  "$id": "https://example.invalid/schemas/claim-value-observation.schema.json",
  "title": "Claim Dynamic Value Observation",
  "type": "object",
  "additionalProperties": false,
  "required": [
    "schema_version",
    "value_observation_id",
    "claim_id",
    "value",
    "unit",
    "as_of",
    "recorded_at",
    "claim_grade",
    "source_observation_ids",
    "sensitivity"
  ],
  "properties": {
    "schema_version": {
      "const": "0.1.0"
    },
    "value_observation_id": {
      "type": "string",
      "pattern": "^cvo-[A-Za-z0-9._-]+$"
    },
    "claim_id": {
      "type": "string",
      "pattern": "^clm-[A-Za-z0-9._-]+$"
    },
    "value": {
      "type": "number"
    },
    "unit": {
      "type": "string",
      "minLength": 1
    },
    "as_of": {
      "type": "string",
      "format": "date-time"
    },
    "recorded_at": {
      "type": "string",
      "format": "date-time"
    },
    "claim_grade": {
      "enum": [
        "A",
        "B",
        "C",
        "D"
      ]
    },
    "source_observation_ids": {
      "type": "array",
      "minItems": 1,
      "uniqueItems": true,
      "items": {
        "type": "string",
        "pattern": "^sob-[A-Za-z0-9._-]+$"
      }
    },
    "notes": {
      "type": [
        "string",
        "null"
      ]
    },
    "sensitivity": {
      "enum": [
        "public",
        "internal",
        "confidential",
        "restricted"
      ]
    }
  }
}
