{
  "schema_version": "0.1.0",
  "value_observation_id": "cvo-synthetic-r2-001",
  "claim_id": "clm-synthetic-r2-001",
  "value": 100,
  "unit": "synthetic-units",
  "as_of": "2026-08-31T00:30:00Z",
  "recorded_at": "2026-08-31T01:00:00Z",
  "claim_grade": "C",
  "source_observation_ids": [
    "sob-synthetic-001"
  ],
  "notes": "Synthetic dynamic value.",
  "sensitivity": "public"
}
